{
  "$schema": "https://json-schema.org/draft/2020-12/schema",
  "$id": "https://code430.invalid/report.schema.v1.json",
  "title": "Code 430 in-game issue report, version 1",
  "description": "What the game saves in user://reports/<id>/report.json and sends to the report relay. Strings are already redacted (home directory as ~, user name as <user>).",
  "type": "object",
  "additionalProperties": false,
  "required": ["version", "id", "created_at", "title", "description", "area", "severity", "credit_name", "has_screenshot", "diagnostics", "log_tail"],
  "properties": {
    "version": {"const": 1},
    "id": {"type": "string", "pattern": "^[0-9]{8}T[0-9]{6}Z-[0-9a-f]{8}$", "description": "UTC timestamp plus eight random hex digits; the relay files each id at most once."},
    "created_at": {"type": "string", "pattern": "^[0-9]{4}-[0-9]{2}-[0-9]{2}T[0-9]{2}:[0-9]{2}:[0-9]{2}Z$"},
    "title": {"type": "string", "minLength": 1, "maxLength": 120},
    "description": {"type": "string", "maxLength": 4000},
    "area": {"enum": ["roads", "traffic", "pedestrians", "vehicles", "world", "visuals", "performance", "controls", "audio", "crash", "other"]},
    "severity": {"enum": ["cosmetic", "annoying", "blocks_play", "crash"]},
    "credit_name": {"type": "string", "maxLength": 60, "description": "Optional name to credit; empty for anonymous."},
    "has_screenshot": {"type": "boolean"},
    "log_tail": {"type": "array", "maxItems": 200, "items": {"type": "string", "maxLength": 500}},
    "diagnostics": {
      "type": "object",
      "additionalProperties": false,
      "required": ["build", "engine", "machine", "settings", "packs", "session", "place", "frame_time"],
      "properties": {
        "build": {
          "type": "object",
          "additionalProperties": false,
          "required": ["commit", "branch", "date", "dirty", "source"],
          "properties": {
            "commit": {"type": "string", "maxLength": 40},
            "branch": {"type": "string", "maxLength": 120},
            "date": {"type": "string", "maxLength": 40},
            "dirty": {"type": "boolean"},
            "source": {"enum": ["export", "dev"]}
          }
        },
        "engine": {
          "type": "object",
          "additionalProperties": false,
          "required": ["godot"],
          "properties": {"godot": {"type": "string", "maxLength": 80}}
        },
        "machine": {
          "type": "object",
          "additionalProperties": false,
          "required": ["os", "distribution", "os_version", "cpu", "cpu_count", "gpu", "gpu_vendor", "graphics_api", "memory_mb", "resolution", "deck"],
          "properties": {
            "os": {"type": "string", "maxLength": 40},
            "distribution": {"type": "string", "maxLength": 80},
            "os_version": {"type": "string", "maxLength": 80},
            "cpu": {"type": "string", "maxLength": 120},
            "cpu_count": {"type": "integer", "minimum": 0},
            "gpu": {"type": "string", "maxLength": 120},
            "gpu_vendor": {"type": "string", "maxLength": 80},
            "graphics_api": {"type": "string", "maxLength": 80},
            "memory_mb": {"type": "integer", "minimum": 0},
            "resolution": {"type": "array", "items": {"type": "integer", "minimum": 0}, "minItems": 2, "maxItems": 2},
            "deck": {"type": "boolean"}
          }
        },
        "settings": {
          "type": "object",
          "additionalProperties": false,
          "required": ["preset", "tone_mode"],
          "properties": {
            "preset": {"type": "string", "maxLength": 40},
            "tone_mode": {"type": "string", "maxLength": 40}
          }
        },
        "packs": {
          "type": "array",
          "maxItems": 64,
          "items": {
            "type": "object",
            "additionalProperties": false,
            "required": ["id", "version"],
            "properties": {
              "id": {"type": "string", "maxLength": 120},
              "version": {"type": "string", "maxLength": 40}
            }
          }
        },
        "session": {
          "type": "object",
          "additionalProperties": false,
          "required": ["role", "peers"],
          "properties": {
            "role": {"enum": ["single", "host", "client"]},
            "peers": {"type": "integer", "minimum": 0, "maximum": 16}
          }
        },
        "place": {
          "type": "object",
          "additionalProperties": false,
          "required": ["x", "y", "z", "heading_deg", "mode", "road", "edge_id", "node_id", "time_of_day"],
          "properties": {
            "x": {"type": "number"},
            "y": {"type": "number"},
            "z": {"type": "number"},
            "heading_deg": {"type": "number"},
            "mode": {"enum": ["foot", "car", "none"]},
            "road": {"type": "string", "maxLength": 120},
            "edge_id": {"type": "string", "maxLength": 80},
            "node_id": {"type": "string", "maxLength": 80},
            "time_of_day": {"type": "string", "maxLength": 8}
          }
        },
        "frame_time": {
          "type": "object",
          "additionalProperties": false,
          "required": ["avg_ms", "p99_ms", "seconds"],
          "properties": {
            "avg_ms": {"type": "number", "minimum": 0},
            "p99_ms": {"type": "number", "minimum": 0},
            "seconds": {"type": "number", "minimum": 0}
          }
        }
      }
    }
  }
}
