{
  "version": 1,
  "id": "20261003T101500Z-3fa9c2d1",
  "created_at": "2026-10-03T10:15:00Z",
  "title": "Roads and junctions: Elgin Street at x 237, z 18",
  "description": "A curb stands inside the junction where the curved road joins.",
  "area": "roads",
  "severity": "annoying",
  "credit_name": "",
  "has_screenshot": true,
  "log_tail": ["testbed: spawn ring 5 chunks in 259 ms; first playable at 497 ms", "pack loaded from ~/Games/code430/packs/ottawa-centretown"],
  "diagnostics": {
    "build": {"commit": "6ac9218abcde", "branch": "main", "date": "2026-10-03T10:00:00Z", "dirty": false, "source": "export"},
    "engine": {"godot": "4.7.2.stable.official.ed1daf0bf"},
    "machine": {
      "os": "Linux", "distribution": "SteamOS", "os_version": "3.7", "cpu": "AMD Custom APU 0405", "cpu_count": 8,
      "gpu": "AMD Custom GPU 0405 (RADV VANGOGH)", "gpu_vendor": "AMD", "graphics_api": "Vulkan 1.3",
      "memory_mb": 15000, "resolution": [1280, 800], "deck": true
    },
    "settings": {"preset": "deck", "tone_mode": "gritty"},
    "packs": [{"id": "code430.ottawa-centretown", "version": "0.1.0"}],
    "session": {"role": "single", "peers": 1},
    "place": {"x": 237.0, "y": 70.4, "z": 18.0, "heading_deg": 152.0, "mode": "car", "road": "Elgin Street", "edge_id": "w435115744.0", "node_id": "c901050337", "time_of_day": "13:10"},
    "frame_time": {"avg_ms": 9.7, "p99_ms": 15.1, "seconds": 30.0}
  }
}
